No.     Time           Source                Destination           Protocol Length Info
      1 0.000000000    127.0.0.1             127.0.0.1             TCP      73     39354 → 12001 [PSH, ACK] Seq=1 Ack=1 Win=512 Len=5 TSval=2231232516 TSecr=2231206287

Frame 1: 73 bytes on wire (584 bits), 73 bytes captured (584 bits) on interface any, id 0
Linux cooked capture v1
Internet Protocol Version 4, Src: 127.0.0.1, Dst: 127.0.0.1
Transmission Control Protocol, Src Port: 39354, Dst Port: 12001, Seq: 1, Ack: 1, Len: 5
Data (5 bytes)

0000  6c 73 26 31 00                                    ls&1.

No.     Time           Source                Destination           Protocol Length Info
      2 0.000026245    127.0.0.1             127.0.0.1             TCP      68     12001 → 39354 [ACK] Seq=1 Ack=6 Win=512 Len=0 TSval=2231232516 TSecr=2231232516

Frame 2: 68 bytes on wire (544 bits), 68 bytes captured (544 bits) on interface any, id 0
Linux cooked capture v1
Internet Protocol Version 4, Src: 127.0.0.1, Dst: 127.0.0.1
Transmission Control Protocol, Src Port: 12001, Dst Port: 39354, Seq: 1, Ack: 6, Len: 0

No.     Time           Source                Destination           Protocol Length Info
      3 0.002301543    127.0.0.1             127.0.0.1             TCP      137    12001 → 39354 [PSH, ACK] Seq=1 Ack=6 Win=512 Len=69 TSval=2231232518 TSecr=2231232516

Frame 3: 137 bytes on wire (1096 bits), 137 bytes captured (1096 bits) on interface any, id 0
Linux cooked capture v1
Internet Protocol Version 4, Src: 127.0.0.1, Dst: 127.0.0.1
Transmission Control Protocol, Src Port: 12001, Dst Port: 39354, Seq: 1, Ack: 6, Len: 69
Data (69 bytes)

0000  63 72 79 70 74 6f 53 65 72 76 69 63 65 2e 70 79   cryptoService.py
0010  0a 66 69 6c 65 53 65 72 76 69 63 65 2e 70 79 0a   .fileService.py.
0020  6e 65 74 77 6f 72 6b 69 6e 67 2e 70 79 0a 5f 5f   networking.py.__
0030  70 79 63 61 63 68 65 5f 5f 0a 73 65 72 76 65 72   pycache__.server
0040  2e 70 79 0a 00                                    .py..

No.     Time           Source                Destination           Protocol Length Info
      4 0.002315702    127.0.0.1             127.0.0.1             TCP      68     39354 → 12001 [ACK] Seq=6 Ack=70 Win=512 Len=0 TSval=2231232518 TSecr=2231232518

Frame 4: 68 bytes on wire (544 bits), 68 bytes captured (544 bits) on interface any, id 0
Linux cooked capture v1
Internet Protocol Version 4, Src: 127.0.0.1, Dst: 127.0.0.1
Transmission Control Protocol, Src Port: 39354, Dst Port: 12001, Seq: 6, Ack: 70, Len: 0

No.     Time           Source                Destination           Protocol Length Info
      5 0.002380124    127.0.0.1             127.0.0.1             TCP      68     12001 → 39354 [FIN, ACK] Seq=70 Ack=6 Win=512 Len=0 TSval=2231232518 TSecr=2231232518

Frame 5: 68 bytes on wire (544 bits), 68 bytes captured (544 bits) on interface any, id 0
Linux cooked capture v1
Internet Protocol Version 4, Src: 127.0.0.1, Dst: 127.0.0.1
Transmission Control Protocol, Src Port: 12001, Dst Port: 39354, Seq: 70, Ack: 6, Len: 0

No.     Time           Source                Destination           Protocol Length Info
      6 0.002446604    127.0.0.1             127.0.0.1             TCP      68     39354 → 12001 [FIN, ACK] Seq=6 Ack=71 Win=512 Len=0 TSval=2231232518 TSecr=2231232518

Frame 6: 68 bytes on wire (544 bits), 68 bytes captured (544 bits) on interface any, id 0
Linux cooked capture v1
Internet Protocol Version 4, Src: 127.0.0.1, Dst: 127.0.0.1
Transmission Control Protocol, Src Port: 39354, Dst Port: 12001, Seq: 6, Ack: 71, Len: 0

No.     Time           Source                Destination           Protocol Length Info
      7 0.002462429    127.0.0.1             127.0.0.1             TCP      68     12001 → 39354 [ACK] Seq=71 Ack=7 Win=512 Len=0 TSval=2231232518 TSecr=2231232518

Frame 7: 68 bytes on wire (544 bits), 68 bytes captured (544 bits) on interface any, id 0
Linux cooked capture v1
Internet Protocol Version 4, Src: 127.0.0.1, Dst: 127.0.0.1
Transmission Control Protocol, Src Port: 12001, Dst Port: 39354, Seq: 71, Ack: 7, Len: 0

No.     Time           Source                Destination           Protocol Length Info
      8 0.002557358    127.0.0.1             127.0.0.1             TCP      76     44170 → 12001 [SYN] Seq=0 Win=65495 Len=0 MSS=65495 SACK_PERM=1 TSval=2231232518 TSecr=0 WS=128

Frame 8: 76 bytes on wire (608 bits), 76 bytes captured (608 bits) on interface any, id 0
Linux cooked capture v1
Internet Protocol Version 4, Src: 127.0.0.1, Dst: 127.0.0.1
Transmission Control Protocol, Src Port: 44170, Dst Port: 12001, Seq: 0, Len: 0

No.     Time           Source                Destination           Protocol Length Info
      9 0.002571261    127.0.0.1             127.0.0.1             TCP      76     12001 → 44170 [SYN, ACK] Seq=0 Ack=1 Win=65483 Len=0 MSS=65495 SACK_PERM=1 TSval=2231232518 TSecr=2231232518 WS=128

Frame 9: 76 bytes on wire (608 bits), 76 bytes captured (608 bits) on interface any, id 0
Linux cooked capture v1
Internet Protocol Version 4, Src: 127.0.0.1, Dst: 127.0.0.1
Transmission Control Protocol, Src Port: 12001, Dst Port: 44170, Seq: 0, Ack: 1, Len: 0

No.     Time           Source                Destination           Protocol Length Info
     10 0.002583579    127.0.0.1             127.0.0.1             TCP      68     44170 → 12001 [ACK] Seq=1 Ack=1 Win=65536 Len=0 TSval=2231232518 TSecr=2231232518

Frame 10: 68 bytes on wire (544 bits), 68 bytes captured (544 bits) on interface any, id 0
Linux cooked capture v1
Internet Protocol Version 4, Src: 127.0.0.1, Dst: 127.0.0.1
Transmission Control Protocol, Src Port: 44170, Dst Port: 12001, Seq: 1, Ack: 1, Len: 0
