No.     Time           Source                Destination           Protocol Length Info
      1 0.000000000    127.0.0.1             127.0.0.1             TCP      73     54766 → 12001 [PSH, ACK] Seq=1 Ack=1 Win=512 Len=5 TSval=2231344104 TSecr=2231329939

Frame 1: 73 bytes on wire (584 bits), 73 bytes captured (584 bits) on interface any, id 0
Linux cooked capture v1
Internet Protocol Version 4, Src: 127.0.0.1, Dst: 127.0.0.1
Transmission Control Protocol, Src Port: 54766, Dst Port: 12001, Seq: 1, Ack: 1, Len: 5
Data (5 bytes)

0000  73 6c 26 33 00                                    sl&3.

No.     Time           Source                Destination           Protocol Length Info
      2 0.000038627    127.0.0.1             127.0.0.1             TCP      68     12001 → 54766 [ACK] Seq=1 Ack=6 Win=512 Len=0 TSval=2231344104 TSecr=2231344104

Frame 2: 68 bytes on wire (544 bits), 68 bytes captured (544 bits) on interface any, id 0
Linux cooked capture v1
Internet Protocol Version 4, Src: 127.0.0.1, Dst: 127.0.0.1
Transmission Control Protocol, Src Port: 12001, Dst Port: 54766, Seq: 1, Ack: 6, Len: 0

No.     Time           Source                Destination           Protocol Length Info
      3 0.002415391    127.0.0.1             127.0.0.1             TCP      137    12001 → 54766 [PSH, ACK] Seq=1 Ack=6 Win=512 Len=69 TSval=2231344106 TSecr=2231344104

Frame 3: 137 bytes on wire (1096 bits), 137 bytes captured (1096 bits) on interface any, id 0
Linux cooked capture v1
Internet Protocol Version 4, Src: 127.0.0.1, Dst: 127.0.0.1
Transmission Control Protocol, Src Port: 12001, Dst Port: 54766, Seq: 1, Ack: 6, Len: 69
Data (69 bytes)

0000  0a 79 70 2e 72 65 76 72 65 73 0a 5f 5f 65 68 63   .yp.revres.__ehc
0010  61 63 79 70 5f 5f 0a 79 70 2e 67 6e 69 6b 72 6f   acyp__.yp.gnikro
0020  77 74 65 6e 0a 79 70 2e 65 63 69 76 72 65 53 65   wten.yp.ecivreSe
0030  6c 69 66 0a 79 70 2e 65 63 69 76 72 65 53 6f 74   lif.yp.ecivreSot
0040  70 79 72 63 00                                    pyrc.

No.     Time           Source                Destination           Protocol Length Info
      4 0.002429331    127.0.0.1             127.0.0.1             TCP      68     54766 → 12001 [ACK] Seq=6 Ack=70 Win=512 Len=0 TSval=2231344106 TSecr=2231344106

Frame 4: 68 bytes on wire (544 bits), 68 bytes captured (544 bits) on interface any, id 0
Linux cooked capture v1
Internet Protocol Version 4, Src: 127.0.0.1, Dst: 127.0.0.1
Transmission Control Protocol, Src Port: 54766, Dst Port: 12001, Seq: 6, Ack: 70, Len: 0

No.     Time           Source                Destination           Protocol Length Info
      5 0.002497291    127.0.0.1             127.0.0.1             TCP      68     12001 → 54766 [FIN, ACK] Seq=70 Ack=6 Win=512 Len=0 TSval=2231344106 TSecr=2231344106

Frame 5: 68 bytes on wire (544 bits), 68 bytes captured (544 bits) on interface any, id 0
Linux cooked capture v1
Internet Protocol Version 4, Src: 127.0.0.1, Dst: 127.0.0.1
Transmission Control Protocol, Src Port: 12001, Dst Port: 54766, Seq: 70, Ack: 6, Len: 0

No.     Time           Source                Destination           Protocol Length Info
      6 0.002537910    127.0.0.1             127.0.0.1             TCP      68     54766 → 12001 [FIN, ACK] Seq=6 Ack=71 Win=512 Len=0 TSval=2231344106 TSecr=2231344106

Frame 6: 68 bytes on wire (544 bits), 68 bytes captured (544 bits) on interface any, id 0
Linux cooked capture v1
Internet Protocol Version 4, Src: 127.0.0.1, Dst: 127.0.0.1
Transmission Control Protocol, Src Port: 54766, Dst Port: 12001, Seq: 6, Ack: 71, Len: 0

No.     Time           Source                Destination           Protocol Length Info
      7 0.002557335    127.0.0.1             127.0.0.1             TCP      68     12001 → 54766 [ACK] Seq=71 Ack=7 Win=512 Len=0 TSval=2231344106 TSecr=2231344106

Frame 7: 68 bytes on wire (544 bits), 68 bytes captured (544 bits) on interface any, id 0
Linux cooked capture v1
Internet Protocol Version 4, Src: 127.0.0.1, Dst: 127.0.0.1
Transmission Control Protocol, Src Port: 12001, Dst Port: 54766, Seq: 71, Ack: 7, Len: 0

No.     Time           Source                Destination           Protocol Length Info
      8 0.002688221    127.0.0.1             127.0.0.1             TCP      76     34416 → 12001 [SYN] Seq=0 Win=65495 Len=0 MSS=65495 SACK_PERM=1 TSval=2231344106 TSecr=0 WS=128

Frame 8: 76 bytes on wire (608 bits), 76 bytes captured (608 bits) on interface any, id 0
Linux cooked capture v1
Internet Protocol Version 4, Src: 127.0.0.1, Dst: 127.0.0.1
Transmission Control Protocol, Src Port: 34416, Dst Port: 12001, Seq: 0, Len: 0

No.     Time           Source                Destination           Protocol Length Info
      9 0.002707041    127.0.0.1             127.0.0.1             TCP      76     12001 → 34416 [SYN, ACK] Seq=0 Ack=1 Win=65483 Len=0 MSS=65495 SACK_PERM=1 TSval=2231344106 TSecr=2231344106 WS=128

Frame 9: 76 bytes on wire (608 bits), 76 bytes captured (608 bits) on interface any, id 0
Linux cooked capture v1
Internet Protocol Version 4, Src: 127.0.0.1, Dst: 127.0.0.1
Transmission Control Protocol, Src Port: 12001, Dst Port: 34416, Seq: 0, Ack: 1, Len: 0

No.     Time           Source                Destination           Protocol Length Info
     10 0.002724622    127.0.0.1             127.0.0.1             TCP      68     34416 → 12001 [ACK] Seq=1 Ack=1 Win=65536 Len=0 TSval=2231344106 TSecr=2231344106

Frame 10: 68 bytes on wire (544 bits), 68 bytes captured (544 bits) on interface any, id 0
Linux cooked capture v1
Internet Protocol Version 4, Src: 127.0.0.1, Dst: 127.0.0.1
Transmission Control Protocol, Src Port: 34416, Dst Port: 12001, Seq: 1, Ack: 1, Len: 0
